{
  "receipt_iri":"https://example.org/receipt/1",
  "work_order_iri":"https://example.org/engineering/work-001",
  "authority_decision_iri":"https://example.org/authority/decision-1",
  "repository_identity":"seanchatmangpt/engineering-standards",
  "base_sha":"610944c48bce6377291c088a3e07775e9ef2908b",
  "candidate_sha":"75850a8c145f6b72b5c90a5b3e658e67ca7b2c94",
  "graph_digest":"0000000000000000000000000000000000000000000000000000000000000000",
  "execution_identity":"github-ref-update:refactor/semantic-engineering-protocol-v26.9.21",
  "consequence_digest":"1111111111111111111111111111111111111111111111111111111111111111",
  "verifier_identity":"engineering-standards/root-court",
  "observed_consequence":"candidate ref points at the declared commit",
  "replay_identity":"engineering-standards:root:v26.9.21",
  "observed_at":"2026-09-21T21:00:00Z",
  "process_event_iris":["https://example.org/process/event-1"]
}
